{
  "$schema": "https://json-schema.org/draft/2020-12/schema",
  "$id": "https://shulker.sh/schema/v1/lock.json",
  "title": "shulker.lock",
  "description": "Shulker lock file. Tool-owned, key-sorted, pretty-printed. Records the exact resolution of shulker.json; install and build read only this file.",
  "type": "object",
  "required": ["lockVersion", "minecraft", "loader", "java", "modpacks", "mods", "players"],
  "additionalProperties": false,
  "properties": {
    "lockVersion": { "type": "integer", "const": 1 },
    "minecraft": {
      "type": "string",
      "minLength": 1,
      "description": "Resolved Minecraft version id, exactly as Mojang's manifest names it."
    },
    "loader": {
      "type": "object",
      "required": ["type", "version"],
      "additionalProperties": false,
      "properties": {
        "type": { "type": "string", "enum": ["fabric", "quilt", "neoforge", "forge"] },
        "version": { "type": "string", "minLength": 1, "description": "Resolved loader version, exactly as the loader's meta names it." },
        "provides": {
          "type": "object",
          "additionalProperties": { "type": "string", "minLength": 1 },
          "description": "Mod ids the loader jar provides, with their versions, e.g. the fabricloader version the Quilt loader stands in for. Validation treats them as installed."
        },
        "client": {
          "$ref": "#/$defs/download",
          "description": "NeoForge, Forge: the installer jar, locked the first time `link mojang` runs its client install. The client libraries the installer downloads itself stay unlocked, like the files Fabric's launcher fetches."
        },
        "server": {
          "type": "object",
          "required": ["sha512"],
          "additionalProperties": false,
          "description": "Server launcher, present once a server target has been installed.",
          "properties": {
            "installer": { "type": "string", "minLength": 1, "description": "Fabric: installer version whose bundled server launcher is locked." },
            "url": { "type": "string", "format": "uri", "description": "Download url of the jar in sha512. The quilt-server-launch.jar shulker generates has none." },
            "sha512": { "$ref": "#/$defs/sha512", "description": "The server launch jar: Fabric's bundled launcher, or the quilt-server-launch.jar shulker generates. NeoForge and Forge: their installer jar, which shulker runs offline into each server dir that doesn't have this loader version yet." },
            "libraries": {
              "type": "object",
              "additionalProperties": { "$ref": "#/$defs/download" },
              "description": "Quilt: the loader's libraries. NeoForge and Forge: every library their installer would download, so it runs offline. Keyed by Maven coordinate, placed under libraries/."
            }
          }
        }
      }
    },
    "java": {
      "type": "object",
      "required": ["major", "component"],
      "additionalProperties": false,
      "properties": {
        "major": { "type": "integer", "minimum": 8, "description": "javaVersion.majorVersion from the Mojang version json, or the override's major." },
        "component": { "type": "string", "minLength": 1, "description": "Mojang runtime component name, e.g. java-runtime-epsilon. Used to fetch the managed runtime." }
      }
    },
    "server": {
      "$ref": "#/$defs/download",
      "description": "The vanilla server jar, present once a server target has been installed. Fabric's launcher finds it in .fabric/server/, Quilt's starts it as server.jar, and the NeoForge and Forge installers patch it from libraries/."
    },
    "modpacks": {
      "type": "object",
      "propertyNames": { "$ref": "#/$defs/requireKey" },
      "additionalProperties": { "$ref": "#/$defs/modpack" },
      "description": "Every modpack in the manifest's requires, keyed by its requires key."
    },
    "mods": {
      "type": "object",
      "propertyNames": { "$ref": "#/$defs/requireKey" },
      "additionalProperties": { "$ref": "#/$defs/mod" },
      "description": "Every mod in the resolved set, direct and transitive, keyed by its requires key or, for a dependency, its in-jar mod id."
    },
    "players": {
      "type": "array",
      "items": { "$ref": "#/$defs/player" },
      "description": "Every player referenced anywhere in the manifest, fully resolved. uuid is the identity across renames."
    }
  },
  "$defs": {
    "sha256": { "type": "string", "pattern": "^[0-9a-f]{64}$" },
    "sha512": { "type": "string", "pattern": "^[0-9a-f]{128}$" },
    "download": {
      "type": "object",
      "required": ["url", "sha512"],
      "additionalProperties": false,
      "properties": {
        "url": { "type": "string", "format": "uri" },
        "sha512": { "$ref": "#/$defs/sha512" }
      }
    },
    "gitCommit": { "type": "string", "pattern": "^[0-9a-f]{40}$" },
    "uuid": { "type": "string", "pattern": "^[0-9a-f]{8}-[0-9a-f]{4}-[0-9a-f]{4}-[0-9a-f]{4}-[0-9a-f]{12}$" },
    "modId": { "type": "string", "pattern": "^[a-z][a-z0-9_-]{1,63}$" },
    "requireKey": { "type": "string", "pattern": "^[a-z0-9][a-z0-9._-]{0,63}$" },
    "modrinthId": { "type": "string", "pattern": "^[A-Za-z0-9]{8}$" },
    "curseforgeId": { "type": "integer", "minimum": 1 },
    "modpack": {
      "type": "object",
      "required": ["source"],
      "additionalProperties": false,
      "properties": {
        "source": { "type": "string", "minLength": 1, "description": "The manifest source at resolution time. A different source in the manifest makes the lock out of date." },
        "ref": { "type": "string", "minLength": 1, "description": "The manifest ref at resolution time. Git sources only." },
        "commit": { "$ref": "#/$defs/gitCommit", "description": "Resolved commit. Git sources only." },
        "dirSha256": { "$ref": "#/$defs/sha256", "description": "Content hash of the pack's shulker.json and override directories in sorted path order, excluding its lock, build output, and data. Local-path sources only." },
        "sha256": { "$ref": "#/$defs/sha256", "description": "Hash of the fetched manifest. Raw manifest URL sources only." },
        "locked": { "type": "boolean", "const": true, "description": "Present when the modpack's mods were copied from its lock. Absent means they were resolved from its manifest." },
        "lockSha256": { "$ref": "#/$defs/sha256", "description": "Hash of the modpack's lock at resolution time. Present exactly when locked is." }
      },
      "oneOf": [
        { "required": ["commit"] },
        { "required": ["dirSha256"], "not": { "required": ["ref"] } },
        { "required": ["sha256"], "not": { "required": ["ref"] } }
      ],
      "dependentRequired": { "locked": ["lockSha256"], "lockSha256": ["locked"] }
    },
    "mod": {
      "type": "object",
      "required": ["provider", "project", "version", "versionNumber", "filename", "url", "sha512", "side", "channel", "requiredBy", "aliases"],
      "additionalProperties": false,
      "properties": {
        "provider": { "type": "string", "enum": ["modrinth", "curseforge"] },
        "project": { "description": "Provider project id, typed as the provider types it." },
        "version": { "description": "Provider version id (Modrinth) or file id (CurseForge)." },
        "versionNumber": { "type": "string", "minLength": 1, "description": "Provider display string. Never parsed." },
        "filename": { "type": "string", "minLength": 1, "pattern": "^[^/\\\\]+\\.jar$" },
        "url": {
          "type": ["string", "null"],
          "format": "uri",
          "description": "Download url. null when the author disabled third-party distribution; page is then required."
        },
        "page": {
          "type": "string",
          "format": "uri",
          "description": "Provider file page for manual download. Present only when url is null."
        },
        "sha512": { "$ref": "#/$defs/sha512", "description": "Cache key and install verification hash." },
        "size": { "type": "integer", "minimum": 1, "description": "Jar size in bytes as the provider reports it, for the download bar. Absent on entries locked before shulker recorded sizes; filled in when the mod is next resolved." },
        "side": { "type": "string", "enum": ["client", "server", "both"], "description": "Effective side after any manifest override." },
        "channel": { "type": "string", "enum": ["release", "beta", "alpha"], "description": "Least stable channel accepted when this version was picked: the manifest's channel for a mod listed there or in a pack, the requiring mod's for a dependency. A listed mod whose manifest channel differs makes the lock out of date." },
        "modpack": { "$ref": "#/$defs/requireKey", "description": "Key in modpacks of the locked modpack this entry was copied from. Absent for the project's own mods and the dependencies resolved for them." },
        "modId": { "$ref": "#/$defs/modId", "description": "The jar's in-jar mod id. Present only when it differs from the entry's key; dependencies, validation and requiredBy use it." },
        "requiredBy": {
          "type": "array",
          "uniqueItems": true,
          "items": { "$ref": "#/$defs/requireKey" },
          "description": "Mod ids (or modpack keys) whose jar metadata depends on this mod. Empty plus absent from the manifest's requires and every modpack means orphan."
        },
        "aliases": {
          "type": "object",
          "additionalProperties": false,
          "properties": {
            "modrinth": { "$ref": "#/$defs/modrinthId" },
            "curseforge": { "$ref": "#/$defs/curseforgeId" }
          },
          "description": "The same mod's project id on other providers, discovered on first download."
        }
      },
      "allOf": [
        {
          "if": { "properties": { "provider": { "const": "modrinth" } } },
          "then": {
            "properties": {
              "project": { "$ref": "#/$defs/modrinthId" },
              "version": { "$ref": "#/$defs/modrinthId" }
            }
          }
        },
        {
          "if": { "properties": { "provider": { "const": "curseforge" } } },
          "then": {
            "properties": {
              "project": { "$ref": "#/$defs/curseforgeId" },
              "version": { "$ref": "#/$defs/curseforgeId" }
            }
          }
        },
        {
          "if": { "properties": { "url": { "type": "null" } } },
          "then": { "required": ["page"] },
          "else": { "not": { "required": ["page"] } }
        }
      ]
    },
    "player": {
      "type": "object",
      "required": ["name", "uuid", "resolvedAt"],
      "additionalProperties": false,
      "properties": {
        "name": { "type": "string", "pattern": "^[A-Za-z0-9_]{3,16}$" },
        "uuid": { "$ref": "#/$defs/uuid" },
        "resolvedAt": { "type": "string", "format": "date-time", "description": "When this name/uuid pair was last confirmed against Mojang." }
      }
    }
  }
}
